[
  {
    "id": "aurora-ledger",
    "title": "Aurora Ledger",
    "subtitle": "Double-entry accounting engine for multi-currency payments",
    "description": "<p>A ledger service handling settlement across fourteen currencies, built to guarantee that every transaction balances to zero even under partial failure.</p><h2>The problem</h2><p>The existing system reconciled overnight in a batch job. A failed payout could sit mis-stated for eighteen hours, and finance caught the drift by hand.</p><h2>What I built</h2><ul><li>An append-only ledger with idempotent transaction posting</li><li>Deterministic replay from the event log for audits</li><li>A reconciliation service that closes the books continuously</li></ul><p>Reconciliation lag dropped from ~18 hours to under 400ms at p99.</p>",
    "cover_image": "/images/project-aurora-ledger.svg",
    "tech_stack": ["Go", "PostgreSQL", "Kafka", "gRPC", "Kubernetes"],
    "project_role": "Lead Engineer",
    "github_url": "https://github.com/example/aurora-ledger",
    "live_url": "https://example.com/aurora",
    "featured": true,
    "sort_order": 1,
    "is_published": true
  },
  {
    "id": "signal-atlas",
    "title": "Signal Atlas",
    "subtitle": "Real-time observability for edge deployments",
    "description": "<p>A telemetry pipeline collecting metrics from roughly 3,000 edge nodes on intermittent connections, where the usual push-based agents simply stop working.</p><h2>Approach</h2><p>Nodes buffer locally and reconcile on reconnect, so a device offline for a week still produces a gap-free time series once it comes back.</p><ul><li>Store-and-forward agent written in Rust</li><li>Backfill-aware ingestion that repairs out-of-order windows</li><li>Query layer serving dashboards over a columnar store</li></ul>",
    "cover_image": "/images/project-signal-atlas.svg",
    "tech_stack": ["Rust", "ClickHouse", "React", "WebSockets"],
    "project_role": "Backend Architect",
    "github_url": "https://github.com/example/signal-atlas",
    "live_url": "",
    "featured": true,
    "sort_order": 2,
    "is_published": true
  },
  {
    "id": "quiet-hours",
    "title": "Quiet Hours",
    "subtitle": "A focus timer that respects your calendar",
    "description": "<p>A small macOS menu-bar app that reads your calendar and blocks notifications during deep-work blocks — without needing an account or sending anything to a server.</p><p>Everything runs locally. The whole app is about 4MB.</p>",
    "cover_image": "",
    "tech_stack": ["Swift", "SwiftUI", "EventKit"],
    "project_role": "Solo Project",
    "github_url": "https://github.com/example/quiet-hours",
    "live_url": "",
    "featured": false,
    "sort_order": 3,
    "is_published": true
  },
  {
    "id": "meridian-design-system",
    "title": "Meridian",
    "subtitle": "Design system and component library for a 40-person product org",
    "description": "<p>Consolidated four divergent component libraries into one system, then migrated eleven applications onto it without freezing feature work.</p><h2>Outcome</h2><ul><li>Component duplication fell from 340 components to 92</li><li>Accessibility violations dropped 87% against automated audits</li><li>New-screen build time roughly halved</li></ul><p>The hard part was never the components — it was the migration path that let teams adopt it incrementally.</p>",
    "cover_image": "/images/project-meridian.svg",
    "tech_stack": ["TypeScript", "React", "Storybook", "Figma API"],
    "project_role": "Design Systems Lead",
    "github_url": "",
    "live_url": "https://example.com/meridian",
    "featured": false,
    "sort_order": 4,
    "is_published": true
  }
]
